commit	timestamp_utc	idea_id	title	evidence_type	mechanism	expected_assets	feature_inputs	oos_hypothesis	falsification	references	human_notes	train_cagr	validation_cagr	oos_cagr	benchmark_oos_cagr	excess_oos_cagr_vs_dbmf	ruined	status	description
0b77142	2026-05-29T14:31:50Z	079_full_macro_top_two_one_month_score_weighted	Full macro top-two one-month score-weighted momentum	replication_of_known_anomaly	Retail-accessible ETF momentum can persist because macro regime information diffuses slowly across investor mandates, and a cash fallback avoids forced risk exposure when recent leadership is weak.	SPY;QQQ;RSP;IWM;USMV;QUAL;MTUM;VLUE;XLK;XLY;XLC;XLI;XLF;XLV;XLP;XLU;XLE;SMH;SOXX;XBI;HYG;LQD;GLD;DBC;IEF;TLT;SGOV	price_momentum_21d;score_weighted_top2	This retail ETF momentum variant can improve validation CAGR without ruin; locked OOS and DBMF excess remain diagnostics only.	Reject if it crashes, ruins, lacks actual public feature usage when claimed, has non-positive validation CAGR, or fails to improve on the prior best validation CAGR.	Jegadeesh and Titman (1993), Returns to Buying Winners and Selling Losers;Moskowitz, Ooi, and Pedersen (2012), Time Series Momentum;Public Yahoo Finance ETF adjusted-close prices via fixed prepare.py cache	Top-2 21-day score-weighted ETF momentum, with SGOV fallback.	0.096288	0.333551	0.643494	0.175494	0.467999	false	discard	Top-2 21-day score-weighted ETF momentum, with SGOV fallback. | feature_usage_columns: beige_beige_activity_score,beige_beige_labor_score,beige_beige_price_pressure_score,beige_beige_token_count,fomc_hawkish_minus_dovish,fomc_token_count,fomc_uncertainty_score,sec_sec_10k_count,sec_sec_10q_count,sec_sec_8k_count,sec_sec_filing_count | feature_source_artifacts: /Users/nyp/.cache/macroresearch/iter_4/fomc/fomc_events.tsv,/Users/nyp/.cache/macroresearch/iter_4/beige_book/beige_book_events.tsv,/Users/nyp/.cache/macroresearch/iter_4/sec/sec_filings.tsv
0b77142	2026-05-29T14:32:07Z	080_equity_sector_top_two_blended_score_weighted	Equity-sector top-two blended momentum	replication_of_known_anomaly	Retail-accessible ETF momentum can persist because macro regime information diffuses slowly across investor mandates, and a cash fallback avoids forced risk exposure when recent leadership is weak.	SPY;QQQ;RSP;IWM;USMV;QUAL;MTUM;VLUE;XLK;XLY;XLC;XLI;XLF;XLV;XLP;XLU;XLE;SMH;SOXX;XBI;SGOV	price_blended_3_6_12_month_momentum;score_weighted_top2	This retail ETF momentum variant can improve validation CAGR without ruin; locked OOS and DBMF excess remain diagnostics only.	Reject if it crashes, ruins, lacks actual public feature usage when claimed, has non-positive validation CAGR, or fails to improve on the prior best validation CAGR.	Jegadeesh and Titman (1993), Returns to Buying Winners and Selling Losers;Moskowitz, Ooi, and Pedersen (2012), Time Series Momentum;Public Yahoo Finance ETF adjusted-close prices via fixed prepare.py cache	Top-2 21-day score-weighted ETF momentum, blended 3/6/12-month score, with SGOV fallback.	0.092000	0.172452	0.271333	0.175494	0.095838	false	discard	Top-2 21-day score-weighted ETF momentum, blended 3/6/12-month score, with SGOV fallback. | feature_usage_columns: beige_beige_activity_score,beige_beige_labor_score,beige_beige_price_pressure_score,beige_beige_token_count,fomc_hawkish_minus_dovish,fomc_token_count,fomc_uncertainty_score,sec_sec_10k_count,sec_sec_10q_count,sec_sec_8k_count,sec_sec_filing_count | feature_source_artifacts: /Users/nyp/.cache/macroresearch/iter_4/fomc/fomc_events.tsv,/Users/nyp/.cache/macroresearch/iter_4/beige_book/beige_book_events.tsv,/Users/nyp/.cache/macroresearch/iter_4/sec/sec_filings.tsv
