commit	timestamp_utc	idea_id	title	evidence_type	mechanism	expected_assets	feature_inputs	oos_hypothesis	falsification	references	human_notes	train_cagr	validation_cagr	oos_cagr	benchmark_oos_cagr	excess_oos_cagr_vs_dbmf	ruined	status	description
0b77142	2026-05-28T16:09:31Z	sector_top1_1m_voltarget_020	Sector one-month momentum with volatility cap	replication_of_known_anomaly	Cross-asset and sector ETF momentum can persist because macro regime information diffuses slowly across investor mandates, while a cash fallback avoids forcing exposure when recent leadership is negative.	SPY;QQQ;RSP;IWM;USMV;QUAL;MTUM;VLUE;XLK;XLY;XLC;XLI;XLF;XLV;XLP;XLU;XLE;SMH;SOXX;XBI;HYG;LQD;GLD;DBC;IEF;TLT;SGOV	price_momentum_21d;realized_volatility_target	A liquid retail ETF momentum variant can improve validation CAGR without ruin; locked OOS and DBMF excess are diagnostics only.	Reject if it crashes, ruins, has non-positive validation CAGR, or fails to improve on the prior best validation CAGR.	Jegadeesh and Titman (1993), Returns to Buying Winners and Selling Losers;Moskowitz, Ooi, and Pedersen (2012), Time Series Momentum	Sector/style 21-day momentum with selected sleeve scaled toward a 22% realized-volatility target and residual SGOV.	0.094774	0.292850	0.539355	0.175971	0.363384	false	discard	Sector/style 21-day momentum with selected sleeve scaled toward a 22% realized-volatility target and residual SGOV.
0b77142	2026-05-28T16:49:37Z	sector_top2_1m_bestfix_021	Sector/style top-two one-month momentum best-threshold fix	replication_of_known_anomaly	Retail-accessible ETF momentum can persist because macro regime information diffuses slowly across investor mandates, and a cash fallback avoids forced risk exposure when recent leadership is weak.	SPY;QQQ;RSP;IWM;USMV;QUAL;MTUM;VLUE;XLK;XLY;XLC;XLI;XLF;XLV;XLP;XLU;XLE;SMH;SOXX;XBI;HYG;LQD;GLD;DBC;IEF;TLT;SGOV	price_momentum_21d	A liquid retail ETF momentum variant can improve validation CAGR without ruin; locked OOS and DBMF excess are diagnostics only.	Reject if it crashes, ruins, has non-positive validation CAGR, or fails to improve on the prior best validation CAGR.	Jegadeesh and Titman (1993), Returns to Buying Winners and Selling Losers;Moskowitz, Ooi, and Pedersen (2012), Time Series Momentum;Public Yahoo Finance ETF adjusted-close prices via fixed prepare.py cache	Equal-weight top-two 21-day sector/style macro ETF momentum with corrected prior-best validation threshold.	0.113151	0.330491	0.567997	0.175971	0.392025	false	discard	Equal-weight top-two 21-day sector/style macro ETF momentum with corrected prior-best validation threshold.
0b77142	2026-05-28T16:49:41Z	sector_top3_1m_equal_022	Sector/style top-three one-month momentum	replication_of_known_anomaly	Retail-accessible ETF momentum can persist because macro regime information diffuses slowly across investor mandates, and a cash fallback avoids forced risk exposure when recent leadership is weak.	SPY;QQQ;RSP;IWM;USMV;QUAL;MTUM;VLUE;XLK;XLY;XLC;XLI;XLF;XLV;XLP;XLU;XLE;SMH;SOXX;XBI;HYG;LQD;GLD;DBC;IEF;TLT;SGOV	price_momentum_21d	A liquid retail ETF momentum variant can improve validation CAGR without ruin; locked OOS and DBMF excess are diagnostics only.	Reject if it crashes, ruins, has non-positive validation CAGR, or fails to improve on the prior best validation CAGR.	Jegadeesh and Titman (1993), Returns to Buying Winners and Selling Losers;Moskowitz, Ooi, and Pedersen (2012), Time Series Momentum;Public Yahoo Finance ETF adjusted-close prices via fixed prepare.py cache	Equal-weight top-three 21-day sector/style macro ETF momentum.	0.073518	0.309525	0.470402	0.175971	0.294431	false	discard	Equal-weight top-three 21-day sector/style macro ETF momentum.
0b77142	2026-05-28T16:49:44Z	sector_top2_2m_equal_023	Sector/style top-two two-month momentum	replication_of_known_anomaly	Retail-accessible ETF momentum can persist because macro regime information diffuses slowly across investor mandates, and a cash fallback avoids forced risk exposure when recent leadership is weak.	SPY;QQQ;RSP;IWM;USMV;QUAL;MTUM;VLUE;XLK;XLY;XLC;XLI;XLF;XLV;XLP;XLU;XLE;SMH;SOXX;XBI;HYG;LQD;GLD;DBC;IEF;TLT;SGOV	price_momentum_42d	A liquid retail ETF momentum variant can improve validation CAGR without ruin; locked OOS and DBMF excess are diagnostics only.	Reject if it crashes, ruins, has non-positive validation CAGR, or fails to improve on the prior best validation CAGR.	Jegadeesh and Titman (1993), Returns to Buying Winners and Selling Losers;Moskowitz, Ooi, and Pedersen (2012), Time Series Momentum;Public Yahoo Finance ETF adjusted-close prices via fixed prepare.py cache	Equal-weight top-two 42-day sector/style macro ETF momentum.	0.041944	0.129241	0.348120	0.175971	0.172148	false	discard	Equal-weight top-two 42-day sector/style macro ETF momentum.
0b77142	2026-05-28T16:49:47Z	sector_top2_1m_scoreweight_024	Sector/style top-two one-month score-weighted momentum	replication_of_known_anomaly	Retail-accessible ETF momentum can persist because macro regime information diffuses slowly across investor mandates, and a cash fallback avoids forced risk exposure when recent leadership is weak.	SPY;QQQ;RSP;IWM;USMV;QUAL;MTUM;VLUE;XLK;XLY;XLC;XLI;XLF;XLV;XLP;XLU;XLE;SMH;SOXX;XBI;HYG;LQD;GLD;DBC;IEF;TLT;SGOV	price_momentum_21d;score_weighted_top2	A liquid retail ETF momentum variant can improve validation CAGR without ruin; locked OOS and DBMF excess are diagnostics only.	Reject if it crashes, ruins, has non-positive validation CAGR, or fails to improve on the prior best validation CAGR.	Jegadeesh and Titman (1993), Returns to Buying Winners and Selling Losers;Moskowitz, Ooi, and Pedersen (2012), Time Series Momentum;Public Yahoo Finance ETF adjusted-close prices via fixed prepare.py cache	Top-two 21-day sector/style macro ETF momentum weighted by positive momentum score.	0.096288	0.333550	0.627231	0.175971	0.451259	false	keep	Top-two 21-day sector/style macro ETF momentum weighted by positive momentum score.
0b77142	2026-05-28T16:49:52Z	sector_top1_1m_voladj_025	Sector/style top-one one-month volatility-adjusted momentum	replication_of_known_anomaly	Retail-accessible ETF momentum can persist because macro regime information diffuses slowly across investor mandates, and a cash fallback avoids forced risk exposure when recent leadership is weak.	SPY;QQQ;RSP;IWM;USMV;QUAL;MTUM;VLUE;XLK;XLY;XLC;XLI;XLF;XLV;XLP;XLU;XLE;SMH;SOXX;XBI;HYG;LQD;GLD;DBC;IEF;TLT;SGOV	price_momentum_21d;realized_volatility_adjustment	A liquid retail ETF momentum variant can improve validation CAGR without ruin; locked OOS and DBMF excess are diagnostics only.	Reject if it crashes, ruins, has non-positive validation CAGR, or fails to improve on the prior best validation CAGR.	Jegadeesh and Titman (1993), Returns to Buying Winners and Selling Losers;Moskowitz, Ooi, and Pedersen (2012), Time Series Momentum;Public Yahoo Finance ETF adjusted-close prices via fixed prepare.py cache	Top-one sector/style ETF by 21-day momentum divided by realized volatility.	0.056175	0.232141	0.362813	0.175971	0.186842	false	discard	Top-one sector/style ETF by 21-day momentum divided by realized volatility.
0b77142	2026-05-28T16:49:57Z	sector_top2_1m_voladj_026	Sector/style top-two one-month volatility-adjusted momentum	replication_of_known_anomaly	Retail-accessible ETF momentum can persist because macro regime information diffuses slowly across investor mandates, and a cash fallback avoids forced risk exposure when recent leadership is weak.	SPY;QQQ;RSP;IWM;USMV;QUAL;MTUM;VLUE;XLK;XLY;XLC;XLI;XLF;XLV;XLP;XLU;XLE;SMH;SOXX;XBI;HYG;LQD;GLD;DBC;IEF;TLT;SGOV	price_momentum_21d;realized_volatility_adjustment	A liquid retail ETF momentum variant can improve validation CAGR without ruin; locked OOS and DBMF excess are diagnostics only.	Reject if it crashes, ruins, has non-positive validation CAGR, or fails to improve on the prior best validation CAGR.	Jegadeesh and Titman (1993), Returns to Buying Winners and Selling Losers;Moskowitz, Ooi, and Pedersen (2012), Time Series Momentum;Public Yahoo Finance ETF adjusted-close prices via fixed prepare.py cache	Top-two sector/style ETFs by 21-day momentum divided by realized volatility.	0.099552	0.155281	0.338258	0.175971	0.162287	false	discard	Top-two sector/style ETFs by 21-day momentum divided by realized volatility.
0b77142	2026-05-28T16:50:01Z	full_top1_1m_exalts_027	Expanded public ETF top-one one-month momentum	replication_of_known_anomaly	Retail-accessible ETF momentum can persist because macro regime information diffuses slowly across investor mandates, and a cash fallback avoids forced risk exposure when recent leadership is weak.	SPY;QQQ;RSP;IWM;USMV;QUAL;MTUM;VLUE;XLK;XLY;XLC;XLI;XLF;XLV;XLP;XLU;XLE;SMH;SOXX;XBI;HYG;LQD;GLD;DBC;IEF;TLT;SLV;UUP;EFA;EEM;ARKK;SGOV	price_momentum_21d;expanded_public_etf_universe	A liquid retail ETF momentum variant can improve validation CAGR without ruin; locked OOS and DBMF excess are diagnostics only.	Reject if it crashes, ruins, has non-positive validation CAGR, or fails to improve on the prior best validation CAGR.	Jegadeesh and Titman (1993), Returns to Buying Winners and Selling Losers;Moskowitz, Ooi, and Pedersen (2012), Time Series Momentum;Public Yahoo Finance ETF adjusted-close prices via fixed prepare.py cache	Top-one 21-day momentum across expanded public ETF universe including international, dollar, silver, and innovation ETFs.	0.061223	0.195798	1.585406	0.175971	1.409435	false	discard	Top-one 21-day momentum across expanded public ETF universe including international, dollar, silver, and innovation ETFs.
0b77142	2026-05-28T16:50:04Z	full_top2_1m_exalts_028	Expanded public ETF top-two one-month momentum	replication_of_known_anomaly	Retail-accessible ETF momentum can persist because macro regime information diffuses slowly across investor mandates, and a cash fallback avoids forced risk exposure when recent leadership is weak.	SPY;QQQ;RSP;IWM;USMV;QUAL;MTUM;VLUE;XLK;XLY;XLC;XLI;XLF;XLV;XLP;XLU;XLE;SMH;SOXX;XBI;HYG;LQD;GLD;DBC;IEF;TLT;SLV;UUP;EFA;EEM;ARKK;SGOV	price_momentum_21d;expanded_public_etf_universe	A liquid retail ETF momentum variant can improve validation CAGR without ruin; locked OOS and DBMF excess are diagnostics only.	Reject if it crashes, ruins, has non-positive validation CAGR, or fails to improve on the prior best validation CAGR.	Jegadeesh and Titman (1993), Returns to Buying Winners and Selling Losers;Moskowitz, Ooi, and Pedersen (2012), Time Series Momentum;Public Yahoo Finance ETF adjusted-close prices via fixed prepare.py cache	Top-two 21-day momentum across expanded public ETF universe including international, dollar, silver, and innovation ETFs.	0.096251	0.284326	0.912445	0.175971	0.736473	false	discard	Top-two 21-day momentum across expanded public ETF universe including international, dollar, silver, and innovation ETFs.
0b77142	2026-05-28T16:50:07Z	tech_top1_1m_arkk_029	Technology/growth plus innovation top-one one-month momentum	replication_of_known_anomaly	Retail-accessible ETF momentum can persist because macro regime information diffuses slowly across investor mandates, and a cash fallback avoids forced risk exposure when recent leadership is weak.	QQQ;XLK;XLY;XLC;SMH;SOXX;ARKK;MTUM;QUAL;SPY;SGOV	price_momentum_21d;technology_growth_universe	A liquid retail ETF momentum variant can improve validation CAGR without ruin; locked OOS and DBMF excess are diagnostics only.	Reject if it crashes, ruins, has non-positive validation CAGR, or fails to improve on the prior best validation CAGR.	Jegadeesh and Titman (1993), Returns to Buying Winners and Selling Losers;Moskowitz, Ooi, and Pedersen (2012), Time Series Momentum;Public Yahoo Finance ETF adjusted-close prices via fixed prepare.py cache	Top-one 21-day momentum among technology, growth, semiconductors, innovation, and quality ETFs.	-0.014338	0.124621	0.402133	0.175971	0.226162	false	discard	Top-one 21-day momentum among technology, growth, semiconductors, innovation, and quality ETFs.
0b77142	2026-05-28T16:50:10Z	tech_top2_1m_arkk_030	Technology/growth plus innovation top-two one-month momentum	replication_of_known_anomaly	Retail-accessible ETF momentum can persist because macro regime information diffuses slowly across investor mandates, and a cash fallback avoids forced risk exposure when recent leadership is weak.	QQQ;XLK;XLY;XLC;SMH;SOXX;ARKK;MTUM;QUAL;SPY;SGOV	price_momentum_21d;technology_growth_universe	A liquid retail ETF momentum variant can improve validation CAGR without ruin; locked OOS and DBMF excess are diagnostics only.	Reject if it crashes, ruins, has non-positive validation CAGR, or fails to improve on the prior best validation CAGR.	Jegadeesh and Titman (1993), Returns to Buying Winners and Selling Losers;Moskowitz, Ooi, and Pedersen (2012), Time Series Momentum;Public Yahoo Finance ETF adjusted-close prices via fixed prepare.py cache	Top-two 21-day momentum among technology, growth, semiconductors, innovation, and quality ETFs.	-0.019115	0.196817	0.466908	0.175971	0.290937	false	discard	Top-two 21-day momentum among technology, growth, semiconductors, innovation, and quality ETFs.
0b77142	2026-05-28T16:50:12Z	macro_top1_1m_global_031	Global macro top-one one-month momentum	replication_of_known_anomaly	Retail-accessible ETF momentum can persist because macro regime information diffuses slowly across investor mandates, and a cash fallback avoids forced risk exposure when recent leadership is weak.	SPY;QQQ;IWM;RSP;MTUM;HYG;LQD;GLD;SLV;DBC;UUP;EFA;EEM;IEF;TLT;SGOV	price_momentum_21d;global_macro_etfs	A liquid retail ETF momentum variant can improve validation CAGR without ruin; locked OOS and DBMF excess are diagnostics only.	Reject if it crashes, ruins, has non-positive validation CAGR, or fails to improve on the prior best validation CAGR.	Jegadeesh and Titman (1993), Returns to Buying Winners and Selling Losers;Moskowitz, Ooi, and Pedersen (2012), Time Series Momentum;Public Yahoo Finance ETF adjusted-close prices via fixed prepare.py cache	Top-one 21-day momentum across equity, credit, commodities, dollar, duration, and global equity ETFs.	0.181588	0.126675	0.678344	0.175971	0.502373	false	discard	Top-one 21-day momentum across equity, credit, commodities, dollar, duration, and global equity ETFs.
0b77142	2026-05-28T16:50:15Z	macro_top2_1m_global_032	Global macro top-two one-month momentum	replication_of_known_anomaly	Retail-accessible ETF momentum can persist because macro regime information diffuses slowly across investor mandates, and a cash fallback avoids forced risk exposure when recent leadership is weak.	SPY;QQQ;IWM;RSP;MTUM;HYG;LQD;GLD;SLV;DBC;UUP;EFA;EEM;IEF;TLT;SGOV	price_momentum_21d;global_macro_etfs	A liquid retail ETF momentum variant can improve validation CAGR without ruin; locked OOS and DBMF excess are diagnostics only.	Reject if it crashes, ruins, has non-positive validation CAGR, or fails to improve on the prior best validation CAGR.	Jegadeesh and Titman (1993), Returns to Buying Winners and Selling Losers;Moskowitz, Ooi, and Pedersen (2012), Time Series Momentum;Public Yahoo Finance ETF adjusted-close prices via fixed prepare.py cache	Top-two 21-day momentum across equity, credit, commodities, dollar, duration, and global equity ETFs.	0.104645	0.052570	0.692544	0.175971	0.516572	false	discard	Top-two 21-day momentum across equity, credit, commodities, dollar, duration, and global equity ETFs.
0b77142	2026-05-28T16:50:18Z	defensive_top1_1m_033	Defensive macro top-one one-month momentum	replication_of_known_anomaly	Retail-accessible ETF momentum can persist because macro regime information diffuses slowly across investor mandates, and a cash fallback avoids forced risk exposure when recent leadership is weak.	USMV;QUAL;XLP;XLU;XLV;GLD;IEF;TLT;LQD;SGOV	price_momentum_21d;defensive_macro_universe	A liquid retail ETF momentum variant can improve validation CAGR without ruin; locked OOS and DBMF excess are diagnostics only.	Reject if it crashes, ruins, has non-positive validation CAGR, or fails to improve on the prior best validation CAGR.	Jegadeesh and Titman (1993), Returns to Buying Winners and Selling Losers;Moskowitz, Ooi, and Pedersen (2012), Time Series Momentum;Public Yahoo Finance ETF adjusted-close prices via fixed prepare.py cache	Top-one 21-day momentum among defensive equity, gold, duration, credit, and cash ETFs.	-0.007661	0.102110	0.303887	0.175971	0.127916	false	discard	Top-one 21-day momentum among defensive equity, gold, duration, credit, and cash ETFs.
0b77142	2026-05-28T16:50:20Z	defensive_top2_1m_034	Defensive macro top-two one-month momentum	replication_of_known_anomaly	Retail-accessible ETF momentum can persist because macro regime information diffuses slowly across investor mandates, and a cash fallback avoids forced risk exposure when recent leadership is weak.	USMV;QUAL;XLP;XLU;XLV;GLD;IEF;TLT;LQD;SGOV	price_momentum_21d;defensive_macro_universe	A liquid retail ETF momentum variant can improve validation CAGR without ruin; locked OOS and DBMF excess are diagnostics only.	Reject if it crashes, ruins, has non-positive validation CAGR, or fails to improve on the prior best validation CAGR.	Jegadeesh and Titman (1993), Returns to Buying Winners and Selling Losers;Moskowitz, Ooi, and Pedersen (2012), Time Series Momentum;Public Yahoo Finance ETF adjusted-close prices via fixed prepare.py cache	Top-two 21-day momentum among defensive equity, gold, duration, credit, and cash ETFs.	-0.001056	0.115925	0.231954	0.175971	0.055983	false	discard	Top-two 21-day momentum among defensive equity, gold, duration, credit, and cash ETFs.
0b77142	2026-05-28T16:50:24Z	sector_top1_2w_035	Sector/style top-one two-week momentum	replication_of_known_anomaly	Retail-accessible ETF momentum can persist because macro regime information diffuses slowly across investor mandates, and a cash fallback avoids forced risk exposure when recent leadership is weak.	SPY;QQQ;RSP;IWM;USMV;QUAL;MTUM;VLUE;XLK;XLY;XLC;XLI;XLF;XLV;XLP;XLU;XLE;SMH;SOXX;XBI;HYG;LQD;GLD;DBC;IEF;TLT;SGOV	price_momentum_10d	A liquid retail ETF momentum variant can improve validation CAGR without ruin; locked OOS and DBMF excess are diagnostics only.	Reject if it crashes, ruins, has non-positive validation CAGR, or fails to improve on the prior best validation CAGR.	Jegadeesh and Titman (1993), Returns to Buying Winners and Selling Losers;Moskowitz, Ooi, and Pedersen (2012), Time Series Momentum;Public Yahoo Finance ETF adjusted-close prices via fixed prepare.py cache	Top-one 10-day sector/style macro ETF momentum with cash fallback.	0.073519	0.171363	0.287601	0.175971	0.111630	false	discard	Top-one 10-day sector/style macro ETF momentum with cash fallback.
0b77142	2026-05-28T16:50:27Z	sector_top2_2w_036	Sector/style top-two two-week momentum	replication_of_known_anomaly	Retail-accessible ETF momentum can persist because macro regime information diffuses slowly across investor mandates, and a cash fallback avoids forced risk exposure when recent leadership is weak.	SPY;QQQ;RSP;IWM;USMV;QUAL;MTUM;VLUE;XLK;XLY;XLC;XLI;XLF;XLV;XLP;XLU;XLE;SMH;SOXX;XBI;HYG;LQD;GLD;DBC;IEF;TLT;SGOV	price_momentum_10d	A liquid retail ETF momentum variant can improve validation CAGR without ruin; locked OOS and DBMF excess are diagnostics only.	Reject if it crashes, ruins, has non-positive validation CAGR, or fails to improve on the prior best validation CAGR.	Jegadeesh and Titman (1993), Returns to Buying Winners and Selling Losers;Moskowitz, Ooi, and Pedersen (2012), Time Series Momentum;Public Yahoo Finance ETF adjusted-close prices via fixed prepare.py cache	Top-two 10-day sector/style macro ETF momentum with cash fallback.	0.048009	0.166004	0.309001	0.175971	0.133030	false	discard	Top-two 10-day sector/style macro ETF momentum with cash fallback.
0b77142	2026-05-28T16:50:30Z	sector_top1_3w_037	Sector/style top-one three-week momentum	replication_of_known_anomaly	Retail-accessible ETF momentum can persist because macro regime information diffuses slowly across investor mandates, and a cash fallback avoids forced risk exposure when recent leadership is weak.	SPY;QQQ;RSP;IWM;USMV;QUAL;MTUM;VLUE;XLK;XLY;XLC;XLI;XLF;XLV;XLP;XLU;XLE;SMH;SOXX;XBI;HYG;LQD;GLD;DBC;IEF;TLT;SGOV	price_momentum_15d	A liquid retail ETF momentum variant can improve validation CAGR without ruin; locked OOS and DBMF excess are diagnostics only.	Reject if it crashes, ruins, has non-positive validation CAGR, or fails to improve on the prior best validation CAGR.	Jegadeesh and Titman (1993), Returns to Buying Winners and Selling Losers;Moskowitz, Ooi, and Pedersen (2012), Time Series Momentum;Public Yahoo Finance ETF adjusted-close prices via fixed prepare.py cache	Top-one 15-day sector/style macro ETF momentum with cash fallback.	-0.112275	0.147408	0.443747	0.175971	0.267775	false	discard	Top-one 15-day sector/style macro ETF momentum with cash fallback.
0b77142	2026-05-28T16:50:33Z	sector_top2_3w_038	Sector/style top-two three-week momentum	replication_of_known_anomaly	Retail-accessible ETF momentum can persist because macro regime information diffuses slowly across investor mandates, and a cash fallback avoids forced risk exposure when recent leadership is weak.	SPY;QQQ;RSP;IWM;USMV;QUAL;MTUM;VLUE;XLK;XLY;XLC;XLI;XLF;XLV;XLP;XLU;XLE;SMH;SOXX;XBI;HYG;LQD;GLD;DBC;IEF;TLT;SGOV	price_momentum_15d	A liquid retail ETF momentum variant can improve validation CAGR without ruin; locked OOS and DBMF excess are diagnostics only.	Reject if it crashes, ruins, has non-positive validation CAGR, or fails to improve on the prior best validation CAGR.	Jegadeesh and Titman (1993), Returns to Buying Winners and Selling Losers;Moskowitz, Ooi, and Pedersen (2012), Time Series Momentum;Public Yahoo Finance ETF adjusted-close prices via fixed prepare.py cache	Top-two 15-day sector/style macro ETF momentum with cash fallback.	-0.038845	0.178986	0.344070	0.175971	0.168099	false	discard	Top-two 15-day sector/style macro ETF momentum with cash fallback.
