commit	timestamp_utc	idea_id	title	evidence_type	mechanism	expected_assets	feature_inputs	oos_hypothesis	falsification	references	human_notes	train_cagr	validation_cagr	oos_cagr	benchmark_oos_cagr	excess_oos_cagr_vs_dbmf	ruined	status	description
0b77142	2026-05-28T16:50:36Z	sector_top1_1m_minpos_039	Sector/style top-one one-month momentum with positive threshold	replication_of_known_anomaly	Retail-accessible ETF momentum can persist because macro regime information diffuses slowly across investor mandates, and a cash fallback avoids forced risk exposure when recent leadership is weak.	SPY;QQQ;RSP;IWM;USMV;QUAL;MTUM;VLUE;XLK;XLY;XLC;XLI;XLF;XLV;XLP;XLU;XLE;SMH;SOXX;XBI;HYG;LQD;GLD;DBC;IEF;TLT;SGOV	price_momentum_21d;minimum_positive_momentum	A liquid retail ETF momentum variant can improve validation CAGR without ruin; locked OOS and DBMF excess are diagnostics only.	Reject if it crashes, ruins, has non-positive validation CAGR, or fails to improve on the prior best validation CAGR.	Jegadeesh and Titman (1993), Returns to Buying Winners and Selling Losers;Moskowitz, Ooi, and Pedersen (2012), Time Series Momentum;Public Yahoo Finance ETF adjusted-close prices via fixed prepare.py cache	Top-one 21-day sector/style momentum only when best score exceeds two percent, otherwise SGOV.	0.076219	0.268329	0.762171	0.175971	0.586200	false	discard	Top-one 21-day sector/style momentum only when best score exceeds two percent, otherwise SGOV.
0b77142	2026-05-28T16:50:40Z	sector_top2_1m_minpos_040	Sector/style top-two one-month momentum with positive threshold	replication_of_known_anomaly	Retail-accessible ETF momentum can persist because macro regime information diffuses slowly across investor mandates, and a cash fallback avoids forced risk exposure when recent leadership is weak.	SPY;QQQ;RSP;IWM;USMV;QUAL;MTUM;VLUE;XLK;XLY;XLC;XLI;XLF;XLV;XLP;XLU;XLE;SMH;SOXX;XBI;HYG;LQD;GLD;DBC;IEF;TLT;SGOV	price_momentum_21d;minimum_positive_momentum	A liquid retail ETF momentum variant can improve validation CAGR without ruin; locked OOS and DBMF excess are diagnostics only.	Reject if it crashes, ruins, has non-positive validation CAGR, or fails to improve on the prior best validation CAGR.	Jegadeesh and Titman (1993), Returns to Buying Winners and Selling Losers;Moskowitz, Ooi, and Pedersen (2012), Time Series Momentum;Public Yahoo Finance ETF adjusted-close prices via fixed prepare.py cache	Top-two 21-day sector/style momentum only when best score exceeds two percent, otherwise SGOV.	0.110217	0.274838	0.567997	0.175971	0.392025	false	discard	Top-two 21-day sector/style momentum only when best score exceeds two percent, otherwise SGOV.
0b77142	2026-05-29T10:40:37Z	sector_top2_1m_scoreweight_024	Sector/style top-two one-month score-weighted momentum	replication_of_known_anomaly	Retail-accessible ETF momentum can persist because macro regime information diffuses slowly across investor mandates, and a cash fallback avoids forced risk exposure when recent leadership is weak.	SPY;QQQ;RSP;IWM;USMV;QUAL;MTUM;VLUE;XLK;XLY;XLC;XLI;XLF;XLV;XLP;XLU;XLE;SMH;SOXX;XBI;HYG;LQD;GLD;DBC;IEF;TLT;SGOV	price_momentum_21d;score_weighted_top2	A liquid retail ETF momentum variant can improve validation CAGR without ruin; locked OOS and DBMF excess are diagnostics only.	Reject if it crashes, ruins, has non-positive validation CAGR, or fails to improve on the prior best validation CAGR.	Jegadeesh and Titman (1993), Returns to Buying Winners and Selling Losers;Moskowitz, Ooi, and Pedersen (2012), Time Series Momentum;Public Yahoo Finance ETF adjusted-close prices via fixed prepare.py cache	Top-two 21-day sector/style macro ETF momentum weighted by positive momentum score.	0.096288	0.333551	0.635711	0.176411	0.459300	false	keep	Top-two 21-day sector/style macro ETF momentum weighted by positive momentum score.
0b77142	2026-05-29T10:42:37Z	sector_top2_1m_scoreweight_024	Sector/style top-two one-month score-weighted momentum	replication_of_known_anomaly	Retail-accessible ETF momentum can persist because macro regime information diffuses slowly across investor mandates, and a cash fallback avoids forced risk exposure when recent leadership is weak.	SPY;QQQ;RSP;IWM;USMV;QUAL;MTUM;VLUE;XLK;XLY;XLC;XLI;XLF;XLV;XLP;XLU;XLE;SMH;SOXX;XBI;HYG;LQD;GLD;DBC;IEF;TLT;SGOV	price_momentum_21d;score_weighted_top2	A liquid retail ETF momentum variant can improve validation CAGR without ruin; locked OOS and DBMF excess are diagnostics only.	Reject if it crashes, ruins, has non-positive validation CAGR, or fails to improve on the prior best validation CAGR.	Jegadeesh and Titman (1993), Returns to Buying Winners and Selling Losers;Moskowitz, Ooi, and Pedersen (2012), Time Series Momentum;Public Yahoo Finance ETF adjusted-close prices via fixed prepare.py cache	Top-two 21-day sector/style macro ETF momentum weighted by positive momentum score.	0.096288	0.333550	0.635711	0.176411	0.459300	false	keep	Top-two 21-day sector/style macro ETF momentum weighted by positive momentum score.
0b77142	2026-05-29T10:45:01Z	sector_top2_1m_scoreweight_024	Sector/style top-two one-month score-weighted momentum	replication_of_known_anomaly	Retail-accessible ETF momentum can persist because macro regime information diffuses slowly across investor mandates, and a cash fallback avoids forced risk exposure when recent leadership is weak.	SPY;QQQ;RSP;IWM;USMV;QUAL;MTUM;VLUE;XLK;XLY;XLC;XLI;XLF;XLV;XLP;XLU;XLE;SMH;SOXX;XBI;HYG;LQD;GLD;DBC;IEF;TLT;SGOV	price_momentum_21d;score_weighted_top2	A liquid retail ETF momentum variant can improve validation CAGR without ruin; locked OOS and DBMF excess are diagnostics only.	Reject if it crashes, ruins, has non-positive validation CAGR, or fails to improve on the prior best validation CAGR.	Jegadeesh and Titman (1993), Returns to Buying Winners and Selling Losers;Moskowitz, Ooi, and Pedersen (2012), Time Series Momentum;Public Yahoo Finance ETF adjusted-close prices via fixed prepare.py cache	Top-two 21-day sector/style macro ETF momentum weighted by positive momentum score.	0.096288	0.333550	0.635711	0.176411	0.459300	false	discard	Top-two 21-day sector/style macro ETF momentum weighted by positive momentum score.
0b77142	2026-05-29T10:54:24Z	041_sector_style_top_three_one_month_score_weighted_	Sector/style top-three one-month score-weighted momentum	replication_of_known_anomaly	Retail-accessible ETF momentum can persist because macro regime information diffuses slowly across investor mandates, and a cash fallback avoids forced risk exposure when recent leadership is weak.	SPY;QQQ;RSP;IWM;USMV;QUAL;MTUM;VLUE;XLK;XLY;XLC;XLI;XLF;XLV;XLP;XLU;XLE;SMH;SOXX;XBI;HYG;LQD;GLD;DBC;IEF;TLT;SGOV	price_momentum_21d;score_weighted_top3	A liquid retail ETF momentum variant can improve validation CAGR without ruin; locked OOS and DBMF excess are diagnostics only.	Reject if it crashes, ruins, has non-positive validation CAGR, or fails to improve on the prior best validation CAGR.	Jegadeesh and Titman (1993), Returns to Buying Winners and Selling Losers;Moskowitz, Ooi, and Pedersen (2012), Time Series Momentum;Public Yahoo Finance ETF adjusted-close prices via fixed prepare.py cache	Top-three 21-day sector/style macro ETF momentum weighted by positive momentum score.	0.088642	0.296378	0.551144	0.176411	0.374733	false	discard	Top-three 21-day sector/style macro ETF momentum weighted by positive momentum score.
0b77142	2026-05-29T10:55:20Z	042_sector_style_top_four_one_month_score_weighted_m	Sector/style top-four one-month score-weighted momentum	replication_of_known_anomaly	Retail-accessible ETF momentum can persist because macro regime information diffuses slowly across investor mandates, and a cash fallback avoids forced risk exposure when recent leadership is weak.	SPY;QQQ;RSP;IWM;USMV;QUAL;MTUM;VLUE;XLK;XLY;XLC;XLI;XLF;XLV;XLP;XLU;XLE;SMH;SOXX;XBI;HYG;LQD;GLD;DBC;IEF;TLT;SGOV	price_momentum_21d;score_weighted_top4	A liquid retail ETF momentum variant can improve validation CAGR without ruin; locked OOS and DBMF excess are diagnostics only.	Reject if it crashes, ruins, has non-positive validation CAGR, or fails to improve on the prior best validation CAGR.	Jegadeesh and Titman (1993), Returns to Buying Winners and Selling Losers;Moskowitz, Ooi, and Pedersen (2012), Time Series Momentum;Public Yahoo Finance ETF adjusted-close prices via fixed prepare.py cache	Top-four 21-day sector/style macro ETF momentum weighted by positive momentum score.	0.089570	0.250638	0.525940	0.176411	0.349529	false	discard	Top-four 21-day sector/style macro ETF momentum weighted by positive momentum score.
0b77142	2026-05-29T10:56:07Z	043_sector_style_top_two_four_week_score_weighted_mo	Sector/style top-two four-week score-weighted momentum	replication_of_known_anomaly	Retail-accessible ETF momentum can persist because macro regime information diffuses slowly across investor mandates, and a cash fallback avoids forced risk exposure when recent leadership is weak.	SPY;QQQ;RSP;IWM;USMV;QUAL;MTUM;VLUE;XLK;XLY;XLC;XLI;XLF;XLV;XLP;XLU;XLE;SMH;SOXX;XBI;HYG;LQD;GLD;DBC;IEF;TLT;SGOV	price_momentum_20d;score_weighted_top2	A liquid retail ETF momentum variant can improve validation CAGR without ruin; locked OOS and DBMF excess are diagnostics only.	Reject if it crashes, ruins, has non-positive validation CAGR, or fails to improve on the prior best validation CAGR.	Jegadeesh and Titman (1993), Returns to Buying Winners and Selling Losers;Moskowitz, Ooi, and Pedersen (2012), Time Series Momentum;Public Yahoo Finance ETF adjusted-close prices via fixed prepare.py cache	Top-two 20-day sector/style macro ETF momentum weighted by positive momentum score.	0.085357	0.294674	0.510053	0.176411	0.333642	false	discard	Top-two 20-day sector/style macro ETF momentum weighted by positive momentum score.
0b77142	2026-05-29T10:57:11Z	044_sector_style_top_two_five_week_score_weighted_mo	Sector/style top-two five-week score-weighted momentum	replication_of_known_anomaly	Retail-accessible ETF momentum can persist because macro regime information diffuses slowly across investor mandates, and a cash fallback avoids forced risk exposure when recent leadership is weak.	SPY;QQQ;RSP;IWM;USMV;QUAL;MTUM;VLUE;XLK;XLY;XLC;XLI;XLF;XLV;XLP;XLU;XLE;SMH;SOXX;XBI;HYG;LQD;GLD;DBC;IEF;TLT;SGOV	price_momentum_25d;score_weighted_top2	A liquid retail ETF momentum variant can improve validation CAGR without ruin; locked OOS and DBMF excess are diagnostics only.	Reject if it crashes, ruins, has non-positive validation CAGR, or fails to improve on the prior best validation CAGR.	Jegadeesh and Titman (1993), Returns to Buying Winners and Selling Losers;Moskowitz, Ooi, and Pedersen (2012), Time Series Momentum;Public Yahoo Finance ETF adjusted-close prices via fixed prepare.py cache	Top-two 25-day sector/style macro ETF momentum weighted by positive momentum score.	0.117969	0.260004	0.571499	0.176411	0.395088	false	discard	Top-two 25-day sector/style macro ETF momentum weighted by positive momentum score.
0b77142	2026-05-29T10:57:59Z	045_sector_style_top_two_eighteen_day_score_weighted	Sector/style top-two eighteen-day score-weighted momentum	replication_of_known_anomaly	Retail-accessible ETF momentum can persist because macro regime information diffuses slowly across investor mandates, and a cash fallback avoids forced risk exposure when recent leadership is weak.	SPY;QQQ;RSP;IWM;USMV;QUAL;MTUM;VLUE;XLK;XLY;XLC;XLI;XLF;XLV;XLP;XLU;XLE;SMH;SOXX;XBI;HYG;LQD;GLD;DBC;IEF;TLT;SGOV	price_momentum_18d;score_weighted_top2	A liquid retail ETF momentum variant can improve validation CAGR without ruin; locked OOS and DBMF excess are diagnostics only.	Reject if it crashes, ruins, has non-positive validation CAGR, or fails to improve on the prior best validation CAGR.	Jegadeesh and Titman (1993), Returns to Buying Winners and Selling Losers;Moskowitz, Ooi, and Pedersen (2012), Time Series Momentum;Public Yahoo Finance ETF adjusted-close prices via fixed prepare.py cache	Top-two 18-day sector/style macro ETF momentum weighted by positive momentum score.	0.024170	0.214714	0.586664	0.176411	0.410253	false	discard	Top-two 18-day sector/style macro ETF momentum weighted by positive momentum score.
0b77142	2026-05-29T10:58:45Z	046_sector_style_top_two_twenty_four_day_score_weigh	Sector/style top-two twenty-four-day score-weighted momentum	replication_of_known_anomaly	Retail-accessible ETF momentum can persist because macro regime information diffuses slowly across investor mandates, and a cash fallback avoids forced risk exposure when recent leadership is weak.	SPY;QQQ;RSP;IWM;USMV;QUAL;MTUM;VLUE;XLK;XLY;XLC;XLI;XLF;XLV;XLP;XLU;XLE;SMH;SOXX;XBI;HYG;LQD;GLD;DBC;IEF;TLT;SGOV	price_momentum_24d;score_weighted_top2	A liquid retail ETF momentum variant can improve validation CAGR without ruin; locked OOS and DBMF excess are diagnostics only.	Reject if it crashes, ruins, has non-positive validation CAGR, or fails to improve on the prior best validation CAGR.	Jegadeesh and Titman (1993), Returns to Buying Winners and Selling Losers;Moskowitz, Ooi, and Pedersen (2012), Time Series Momentum;Public Yahoo Finance ETF adjusted-close prices via fixed prepare.py cache	Top-two 24-day sector/style macro ETF momentum weighted by positive momentum score.	0.140871	0.182047	0.633444	0.176411	0.457033	false	discard	Top-two 24-day sector/style macro ETF momentum weighted by positive momentum score.
0b77142	2026-05-29T10:59:16Z	047_sector_style_top_two_thirty_day_score_weighted_m	Sector/style top-two thirty-day score-weighted momentum	replication_of_known_anomaly	Retail-accessible ETF momentum can persist because macro regime information diffuses slowly across investor mandates, and a cash fallback avoids forced risk exposure when recent leadership is weak.	SPY;QQQ;RSP;IWM;USMV;QUAL;MTUM;VLUE;XLK;XLY;XLC;XLI;XLF;XLV;XLP;XLU;XLE;SMH;SOXX;XBI;HYG;LQD;GLD;DBC;IEF;TLT;SGOV	price_momentum_30d;score_weighted_top2	A liquid retail ETF momentum variant can improve validation CAGR without ruin; locked OOS and DBMF excess are diagnostics only.	Reject if it crashes, ruins, has non-positive validation CAGR, or fails to improve on the prior best validation CAGR.	Jegadeesh and Titman (1993), Returns to Buying Winners and Selling Losers;Moskowitz, Ooi, and Pedersen (2012), Time Series Momentum;Public Yahoo Finance ETF adjusted-close prices via fixed prepare.py cache	Top-two 30-day sector/style macro ETF momentum weighted by positive momentum score.	0.152402	0.277796	0.549537	0.176411	0.373126	false	discard	Top-two 30-day sector/style macro ETF momentum weighted by positive momentum score.
0b77142	2026-05-29T10:59:54Z	048_sector_style_top_two_sixteen_day_score_weighted_	Sector/style top-two sixteen-day score-weighted momentum	replication_of_known_anomaly	Retail-accessible ETF momentum can persist because macro regime information diffuses slowly across investor mandates, and a cash fallback avoids forced risk exposure when recent leadership is weak.	SPY;QQQ;RSP;IWM;USMV;QUAL;MTUM;VLUE;XLK;XLY;XLC;XLI;XLF;XLV;XLP;XLU;XLE;SMH;SOXX;XBI;HYG;LQD;GLD;DBC;IEF;TLT;SGOV	price_momentum_16d;score_weighted_top2	A liquid retail ETF momentum variant can improve validation CAGR without ruin; locked OOS and DBMF excess are diagnostics only.	Reject if it crashes, ruins, has non-positive validation CAGR, or fails to improve on the prior best validation CAGR.	Jegadeesh and Titman (1993), Returns to Buying Winners and Selling Losers;Moskowitz, Ooi, and Pedersen (2012), Time Series Momentum;Public Yahoo Finance ETF adjusted-close prices via fixed prepare.py cache	Top-two 16-day sector/style macro ETF momentum weighted by positive momentum score.	-0.008491	0.159699	0.609852	0.176411	0.433441	false	discard	Top-two 16-day sector/style macro ETF momentum weighted by positive momentum score.
0b77142	2026-05-29T11:00:38Z	049_sector_style_top_two_twelve_day_score_weighted_m	Sector/style top-two twelve-day score-weighted momentum	replication_of_known_anomaly	Retail-accessible ETF momentum can persist because macro regime information diffuses slowly across investor mandates, and a cash fallback avoids forced risk exposure when recent leadership is weak.	SPY;QQQ;RSP;IWM;USMV;QUAL;MTUM;VLUE;XLK;XLY;XLC;XLI;XLF;XLV;XLP;XLU;XLE;SMH;SOXX;XBI;HYG;LQD;GLD;DBC;IEF;TLT;SGOV	price_momentum_12d;score_weighted_top2	A liquid retail ETF momentum variant can improve validation CAGR without ruin; locked OOS and DBMF excess are diagnostics only.	Reject if it crashes, ruins, has non-positive validation CAGR, or fails to improve on the prior best validation CAGR.	Jegadeesh and Titman (1993), Returns to Buying Winners and Selling Losers;Moskowitz, Ooi, and Pedersen (2012), Time Series Momentum;Public Yahoo Finance ETF adjusted-close prices via fixed prepare.py cache	Top-two 12-day sector/style macro ETF momentum weighted by positive momentum score.	0.008814	0.198929	0.200423	0.176411	0.024012	false	discard	Top-two 12-day sector/style macro ETF momentum weighted by positive momentum score.
0b77142	2026-05-29T11:01:05Z	050_sector_style_top_two_one_month_score_weighted_mo	Sector/style top-two one-month score-weighted momentum with 1% threshold	replication_of_known_anomaly	Retail-accessible ETF momentum can persist because macro regime information diffuses slowly across investor mandates, and a cash fallback avoids forced risk exposure when recent leadership is weak.	SPY;QQQ;RSP;IWM;USMV;QUAL;MTUM;VLUE;XLK;XLY;XLC;XLI;XLF;XLV;XLP;XLU;XLE;SMH;SOXX;XBI;HYG;LQD;GLD;DBC;IEF;TLT;SGOV	price_momentum_21d;score_weighted_top2;minimum_positive_momentum_1pct	A liquid retail ETF momentum variant can improve validation CAGR without ruin; locked OOS and DBMF excess are diagnostics only.	Reject if it crashes, ruins, has non-positive validation CAGR, or fails to improve on the prior best validation CAGR.	Jegadeesh and Titman (1993), Returns to Buying Winners and Selling Losers;Moskowitz, Ooi, and Pedersen (2012), Time Series Momentum;Public Yahoo Finance ETF adjusted-close prices via fixed prepare.py cache	Top-two 21-day sector/style momentum when best score exceeds one percent, otherwise SGOV.	0.096288	0.280710	0.635711	0.176411	0.459300	false	discard	Top-two 21-day sector/style momentum when best score exceeds one percent, otherwise SGOV.
0b77142	2026-05-29T11:01:35Z	051_sector_style_top_two_one_month_score_weighted_mo	Sector/style top-two one-month score-weighted momentum with 1.5% threshold	replication_of_known_anomaly	Retail-accessible ETF momentum can persist because macro regime information diffuses slowly across investor mandates, and a cash fallback avoids forced risk exposure when recent leadership is weak.	SPY;QQQ;RSP;IWM;USMV;QUAL;MTUM;VLUE;XLK;XLY;XLC;XLI;XLF;XLV;XLP;XLU;XLE;SMH;SOXX;XBI;HYG;LQD;GLD;DBC;IEF;TLT;SGOV	price_momentum_21d;score_weighted_top2;minimum_positive_momentum_1_5pct	A liquid retail ETF momentum variant can improve validation CAGR without ruin; locked OOS and DBMF excess are diagnostics only.	Reject if it crashes, ruins, has non-positive validation CAGR, or fails to improve on the prior best validation CAGR.	Jegadeesh and Titman (1993), Returns to Buying Winners and Selling Losers;Moskowitz, Ooi, and Pedersen (2012), Time Series Momentum;Public Yahoo Finance ETF adjusted-close prices via fixed prepare.py cache	Top-two 21-day sector/style momentum when best score exceeds 1.5 percent, otherwise SGOV.	0.090867	0.280710	0.635711	0.176411	0.459300	false	discard	Top-two 21-day sector/style momentum when best score exceeds 1.5 percent, otherwise SGOV.
0b77142	2026-05-29T11:02:32Z	052_sector_style_top_two_one_month_score_weighted_mo	Sector/style top-two one-month score-weighted momentum with 0.5% threshold	replication_of_known_anomaly	Retail-accessible ETF momentum can persist because macro regime information diffuses slowly across investor mandates, and a cash fallback avoids forced risk exposure when recent leadership is weak.	SPY;QQQ;RSP;IWM;USMV;QUAL;MTUM;VLUE;XLK;XLY;XLC;XLI;XLF;XLV;XLP;XLU;XLE;SMH;SOXX;XBI;HYG;LQD;GLD;DBC;IEF;TLT;SGOV	price_momentum_21d;score_weighted_top2;minimum_positive_momentum_0_5pct	A liquid retail ETF momentum variant can improve validation CAGR without ruin; locked OOS and DBMF excess are diagnostics only.	Reject if it crashes, ruins, has non-positive validation CAGR, or fails to improve on the prior best validation CAGR.	Jegadeesh and Titman (1993), Returns to Buying Winners and Selling Losers;Moskowitz, Ooi, and Pedersen (2012), Time Series Momentum;Public Yahoo Finance ETF adjusted-close prices via fixed prepare.py cache	Top-two 21-day sector/style momentum when best score exceeds 0.5 percent, otherwise SGOV.	0.096289	0.333551	0.635711	0.176411	0.459300	false	discard	Top-two 21-day sector/style momentum when best score exceeds 0.5 percent, otherwise SGOV.
0b77142	2026-05-29T11:03:09Z	053_sector_style_top_two_one_month_score_weighted_mo	Sector/style top-two one-month score-weighted momentum without bond ETFs	replication_of_known_anomaly	Retail-accessible ETF momentum can persist because macro regime information diffuses slowly across investor mandates, and a cash fallback avoids forced risk exposure when recent leadership is weak.	SPY;QQQ;RSP;IWM;USMV;QUAL;MTUM;VLUE;XLK;XLY;XLC;XLI;XLF;XLV;XLP;XLU;XLE;SMH;SOXX;XBI;HYG;GLD;DBC;SGOV	price_momentum_21d;score_weighted_top2;no_duration_credit_universe	A liquid retail ETF momentum variant can improve validation CAGR without ruin; locked OOS and DBMF excess are diagnostics only.	Reject if it crashes, ruins, has non-positive validation CAGR, or fails to improve on the prior best validation CAGR.	Jegadeesh and Titman (1993), Returns to Buying Winners and Selling Losers;Moskowitz, Ooi, and Pedersen (2012), Time Series Momentum;Public Yahoo Finance ETF adjusted-close prices via fixed prepare.py cache	Top-two 21-day sector/style momentum excluding duration and investment-grade credit ETFs.	0.085391	0.333551	0.685209	0.176411	0.508798	false	discard	Top-two 21-day sector/style momentum excluding duration and investment-grade credit ETFs.
